{
  "$schema": "../../schema/mod.json",
  "id": "wxl.ground-marks",
  "name": "Ground marks",
  "version": "1.0.0",
  "abi": "0.1.36",
  "description": "A Lua mod: a ring under the target and a cone in front of it that follow it, and a grid on the ground where the camera looks, drawn with wxl.draw.",
  "lua": "init.lua",
  "requires": [
    { "service": "wxl.draw", "version": 1 }
  ],
  "optional": [
    { "service": "wxl.camera", "version": 1 },
    { "service": "wxl.terrain", "version": 1 }
  ]
}
