{
  "$schema": "../../schema/mod.json",
  "id": "wxl.dig-dust",
  "name": "Dig dust",
  "version": "1.0.0",
  "abi": "0.1.40",
  "description": "A Lua mod: clods of earth thrown up and bouncing, a soft dust puff, and grains drawn back into a hole, where the camera looks, every two seconds, drawn with wxl.draw's particles.",
  "lua": "init.lua",
  "requires": [
    { "service": "wxl.draw", "version": 1 }
  ],
  "optional": [
    { "service": "wxl.camera", "version": 1 },
    { "service": "wxl.terrain", "version": 1 }
  ]
}
